{
  "$schema": "https://json-schema.org/draft/2020-12/schema",
  "$id": "https://appsdk.local/contracts/records/merge-record.schema.json",
  "type": "object",
  "required": ["merge_id", "issue_id", "module_id", "fix_candidate_id", "effectiveness_id", "mainline_ref", "candidate_commit", "merge_commit", "candidate_tree_hash", "merged_tree_hash", "change_identity", "result", "created_at"],
  "properties": {"merge_id": {"type": "string"}, "issue_id": {"type": "string"}, "module_id": {"type": "string"}, "fix_candidate_id": {"type": "string"}, "effectiveness_id": {"type": "string"}, "queue_entry_id": {"type": "string"}, "integration_id": {"type": "string"}, "mainline_receipt_id": {"type": "string"}, "milestone_id": {"type": "string"}, "mainline_ref": {"type": "string"}, "candidate_commit": {"type": "string"}, "integration_commit": {"type": "string"}, "merge_commit": {"type": "string"}, "candidate_tree_hash": {"type": "string"}, "integration_tree_hash": {"type": "string"}, "merged_tree_hash": {"type": "string"}, "change_identity": {"enum": ["exact", "tested_integration_exact"]}, "result": {"const": "pass"}, "created_at": {"type": "string"}
  }
}
